{
  "formatVersion": 1,
  "name": "QuadFlow",
  "homepage": "https://github.com/HardHeadHackerHead/QuadFlow",
  "plugins": [
    {
      "id": "chat",
      "name": "Chat",
      "description": "Chat with an OpenAI-compatible LLM endpoint (Ollama, LM Studio, OpenRouter, OpenAI, …): conversations, streamed replies, endpoint settings.",
      "icon": "https://raw.githubusercontent.com/HardHeadHackerHead/QuadFlow/HEAD/plugins/chat/assets/icon.svg",
      "category": "ai-agents",
      "repository": "https://github.com/HardHeadHackerHead/QuadFlow/tree/HEAD/plugins/chat",
      "bundled": true,
      "versions": [
        {
          "version": "1.0.0",
          "apiVersion": "^1.4.0",
          "platforms": [
            "windows",
            "macos",
            "linux"
          ],
          "permissions": [
            "data:chat:write",
            "secrets",
            "clipboard:write"
          ],
          "url": "https://github.com/HardHeadHackerHead/QuadFlow/releases/download/plugin-chat-v1.0.0/chat-1.0.0.zip",
          "sha256": "c0cd9d6ff1c4edd7769589574c5c6eeb0b2a32b952ee6c59103c6fcc5afe606c",
          "size": 13049,
          "releasedAt": "2026-10-23T22:30:26Z"
        }
      ]
    },
    {
      "id": "claude-code",
      "name": "Claude Code",
      "description": "Claude Code agent provider: launch, resume, plan and bypass modes, models from the catalog, usage limits, context-window meter, session titles, Missions worktree scoping, project config and permissions.",
      "icon": "https://raw.githubusercontent.com/HardHeadHackerHead/QuadFlow/HEAD/plugins/claude-code/assets/icon.svg",
      "category": "ai-agents",
      "repository": "https://github.com/HardHeadHackerHead/QuadFlow/tree/HEAD/plugins/claude-code",
      "bundled": true,
      "versions": [
        {
          "version": "1.0.0",
          "apiVersion": "^1.0.0",
          "platforms": [
            "windows",
            "macos",
            "linux"
          ],
          "permissions": [
            "agents:read",
            "fs:read:home",
            "fs:write:project",
            "terminal:spawn",
            "terminal:io"
          ],
          "url": "https://github.com/HardHeadHackerHead/QuadFlow/releases/download/plugin-claude-code-v1.0.0/claude-code-1.0.0.zip",
          "sha256": "84fbd5a4e61d236a74b80a82ca32410a9c7ad9ea7dd2bc7e69bae60618f69470",
          "size": 93802,
          "releasedAt": "2026-10-23T22:30:26Z"
        }
      ]
    },
    {
      "id": "code-quality",
      "name": "Code Quality",
      "description": "Code metrics of the current project: lines of code per language, comment ratio, complexity, test ratio, a quality grade and an optional AI assessment.",
      "icon": "https://raw.githubusercontent.com/HardHeadHackerHead/QuadFlow/HEAD/plugins/code-quality/assets/icon.svg",
      "category": "development",
      "repository": "https://github.com/HardHeadHackerHead/QuadFlow/tree/HEAD/plugins/code-quality",
      "bundled": true,
      "versions": [
        {
          "version": "1.0.0",
          "apiVersion": "^1.4.0",
          "platforms": [
            "windows",
            "macos",
            "linux"
          ],
          "permissions": [
            "fs:read:project",
            "data:chat:write"
          ],
          "url": "https://github.com/HardHeadHackerHead/QuadFlow/releases/download/plugin-code-quality-v1.0.0/code-quality-1.0.0.zip",
          "sha256": "49bf6c999d0878cbd97c3b5b674b2da3f5d37cbe62f38bc6a642671198f97995",
          "size": 16065,
          "releasedAt": "2026-10-23T22:30:26Z"
        }
      ]
    },
    {
      "id": "codex",
      "name": "Codex",
      "description": "OpenAI Codex CLI as a QuadFlow agent provider: launch, resume, approval modes, session discovery, AGENTS.md context, context-window and rate-limit usage from Codex rollout files.",
      "icon": "https://raw.githubusercontent.com/HardHeadHackerHead/QuadFlow/HEAD/plugins/codex/assets/icon.svg",
      "category": "ai-agents",
      "repository": "https://github.com/HardHeadHackerHead/QuadFlow/tree/HEAD/plugins/codex",
      "bundled": true,
      "versions": [
        {
          "version": "1.0.0",
          "apiVersion": "^1.0.0",
          "platforms": [
            "windows",
            "macos",
            "linux"
          ],
          "permissions": [
            "agents:read",
            "fs:read:home",
            "fs:write:project"
          ],
          "url": "https://github.com/HardHeadHackerHead/QuadFlow/releases/download/plugin-codex-v1.0.0/codex-1.0.0.zip",
          "sha256": "b19d342e4ccb98504e9561404482bf917c3d3561f9a7d972be88c7399ce051c1",
          "size": 4430,
          "releasedAt": "2026-10-23T22:30:26Z"
        }
      ]
    },
    {
      "id": "core",
      "name": "QuadFlow Core",
      "description": "The shell's own contributions: Terminals, Agents and Session history.",
      "icon": "https://raw.githubusercontent.com/HardHeadHackerHead/QuadFlow/HEAD/plugins/core/assets/icon.svg",
      "category": "other",
      "repository": "https://github.com/HardHeadHackerHead/QuadFlow/tree/HEAD/plugins/core",
      "bundled": true,
      "versions": [
        {
          "version": "1.0.0",
          "apiVersion": "^1.0.0",
          "platforms": [
            "windows",
            "macos",
            "linux"
          ],
          "permissions": [],
          "url": "https://github.com/HardHeadHackerHead/QuadFlow/releases/download/plugin-core-v1.0.0/core-1.0.0.zip",
          "sha256": "aecb5405f84b36bfed44b4a3e0cdf42e2ae7e5b861522ffc550da400700c3006",
          "size": 2697,
          "releasedAt": "2026-10-23T22:30:26Z"
        }
      ]
    },
    {
      "id": "discord-bot",
      "name": "Discord Bot",
      "description": "Experimental (on hold): mirror terminal sessions into Discord threads and send replies from a Discord role back into the terminal.",
      "icon": "https://raw.githubusercontent.com/HardHeadHackerHead/QuadFlow/HEAD/plugins/discord-bot/assets/icon.svg",
      "category": "media",
      "repository": "https://github.com/HardHeadHackerHead/QuadFlow/tree/HEAD/plugins/discord-bot",
      "bundled": false,
      "versions": [
        {
          "version": "0.1.0",
          "apiVersion": "^1.1.0",
          "platforms": [
            "windows",
            "macos",
            "linux"
          ],
          "permissions": [
            "terminal:io",
            "secrets",
            "sidecar:runtime:node",
            "shell:open-external"
          ],
          "url": "https://github.com/HardHeadHackerHead/QuadFlow/releases/download/plugin-discord-bot-v0.1.0/discord-bot-0.1.0.zip",
          "sha256": "712e7760168f2b20c1be80ebed59c7ec2225a055b8a3802c993fbc9a49014871",
          "size": 583421,
          "releasedAt": "2026-10-23T22:30:26Z"
        }
      ]
    },
    {
      "id": "discovery",
      "name": "Projects",
      "description": "Project discovery: goals, success criteria, research, requirements, questions, references, decisions and notes, with the ideas and plans linked to each project.",
      "icon": "https://raw.githubusercontent.com/HardHeadHackerHead/QuadFlow/HEAD/plugins/discovery/assets/icon.svg",
      "category": "project-management",
      "repository": "https://github.com/HardHeadHackerHead/QuadFlow/tree/HEAD/plugins/discovery",
      "bundled": true,
      "versions": [
        {
          "version": "1.0.0",
          "apiVersion": "^1.0.0",
          "platforms": [
            "windows",
            "macos",
            "linux"
          ],
          "permissions": [
            "data:discovery:write",
            "data:ideas:write",
            "data:plans:read",
            "agents:read",
            "agents:launch"
          ],
          "url": "https://github.com/HardHeadHackerHead/QuadFlow/releases/download/plugin-discovery-v1.0.0/discovery-1.0.0.zip",
          "sha256": "fcd347f1a2179973c173d2abf4b9af0f2dfd36695e3fe298e71e800520c4551e",
          "size": 14041,
          "releasedAt": "2026-10-23T22:30:26Z"
        }
      ]
    },
    {
      "id": "editor",
      "name": "Editor",
      "description": "A CodeMirror file editor pane, one tile per file. Opened from file links and the file explorer (command editor/open { path }).",
      "icon": "https://raw.githubusercontent.com/HardHeadHackerHead/QuadFlow/HEAD/plugins/editor/assets/icon.svg",
      "category": "development",
      "repository": "https://github.com/HardHeadHackerHead/QuadFlow/tree/HEAD/plugins/editor",
      "bundled": true,
      "versions": [
        {
          "version": "1.0.0",
          "apiVersion": "^1.4.0",
          "platforms": [
            "windows",
            "macos",
            "linux"
          ],
          "permissions": [
            "fs:read:project",
            "fs:write:project"
          ],
          "url": "https://github.com/HardHeadHackerHead/QuadFlow/releases/download/plugin-editor-v1.0.0/editor-1.0.0.zip",
          "sha256": "cd842f6b7d7bcf410c3eac9c901853cd760fec6f0c66fca15ed22827ff8c6dfe",
          "size": 398516,
          "releasedAt": "2026-10-23T22:30:26Z"
        }
      ]
    },
    {
      "id": "external-apps",
      "name": "External Apps",
      "description": "Launch external programs, link toolbar buttons to their windows, and embed any app window into a tile (hidden under menus and dialogs). Replaces App Launcher, Window Link and Embed Window.",
      "icon": "https://raw.githubusercontent.com/HardHeadHackerHead/QuadFlow/HEAD/plugins/external-apps/assets/icon.svg",
      "category": "other",
      "repository": "https://github.com/HardHeadHackerHead/QuadFlow/tree/HEAD/plugins/external-apps",
      "bundled": true,
      "versions": [
        {
          "version": "1.0.0",
          "apiVersion": "^1.1.0",
          "platforms": [
            "windows"
          ],
          "permissions": [
            "native:windows"
          ],